{
  "toolCallId": "55555555-5555-4555-8555-555555555555",
  "sessionId": "33333333-3333-4333-8333-333333333333",
  "playerUuid": "44444444-4444-4444-8444-444444444444",
  "module": "recipe",
  "tool": "server.recipe.lookup",
  "arguments": {
    "itemId": "minecraft:crafting_table"
  },
  "sequence": 0
}
